{
  "$schema": "https://json-schema.org/draft/2020-12/schema",
  "title": "Offer",
  "description": "An employment offer extended to a candidate through a job application, including compensation details and start date.",
  "$id": "https://raw.githubusercontent.com/api-evangelist/workday-recruiting/refs/heads/main/json-schema/recruiting-rest-api-offer-schema.json",
  "type": "object",
  "properties": {
    "id": {
      "type": "string",
      "description": "Workday ID (WID) of the offer",
      "example": "11111111-2222-3333-4444-555555555555"
    },
    "jobApplication": {
      "type": "object",
      "description": "A reference to a related Workday resource",
      "properties": {
        "id": {
          "type": "string",
          "description": "Workday ID (WID) of the referenced resource",
          "example": "11111111-2222-3333-4444-555555555555"
        },
        "descriptor": {
          "type": "string",
          "description": "Display name of the referenced resource",
          "example": "Senior Software Engineer"
        }
      }
    },
    "status": {
      "type": "string",
      "enum": [
        "Draft",
        "Pending Approval",
        "Approved",
        "Extended",
        "Accepted",
        "Declined",
        "Rescinded"
      ],
      "description": "Current offer status",
      "example": "Draft"
    },
    "proposedStartDate": {
      "type": "string",
      "format": "date",
      "description": "Proposed start date for employment",
      "example": "2026-05-03"
    },
    "compensationAmount": {
      "type": "number",
      "description": "Offered compensation amount",
      "example": 120000.0
    },
    "compensationFrequency": {
      "type": "string",
      "enum": [
        "Annual",
        "Hourly",
        "Monthly"
      ],
      "description": "Compensation frequency",
      "example": "Annual"
    },
    "currency": {
      "type": "object",
      "description": "A reference to a related Workday resource",
      "properties": {
        "id": {
          "type": "string",
          "description": "Workday ID (WID) of the referenced resource",
          "example": "11111111-2222-3333-4444-555555555555"
        },
        "descriptor": {
          "type": "string",
          "description": "Display name of the referenced resource",
          "example": "Senior Software Engineer"
        }
      }
    },
    "expirationDate": {
      "type": "string",
      "format": "date",
      "description": "Date the offer expires",
      "example": "2026-05-03"
    },
    "createdOn": {
      "type": "string",
      "format": "date-time",
      "description": "Timestamp when the offer was created",
      "example": "2026-05-03T14:30:00Z"
    }
  }
}
