{
  "id": "11111111-2222-3333-4444-555555555555",
  "jobApplication": {
    "id": "11111111-2222-3333-4444-555555555555",
    "descriptor": "Senior Software Engineer"
  },
  "status": "Draft",
  "proposedStartDate": "2026-05-03",
  "compensationAmount": 120000.0,
  "compensationFrequency": "Annual",
  "currency": {
    "id": "11111111-2222-3333-4444-555555555555",
    "descriptor": "Senior Software Engineer"
  },
  "expirationDate": "2026-05-03",
  "createdOn": "2026-05-03T14:30:00Z"
}
